[
  {
    "operation_id": "fake-op:474d9e117f11ea22d3a6afe9bc9900f1",
    "payload": {
      "observer_epoch": "watch:1b7a07ecbf94f7c22920848f3674cdf2",
      "record": {
        "digest": "9e6c3a524a4bb10824bc640c06eff0672bcabc344b9351d69f852a12d993acc2",
        "previous": "0000000000000000000000000000000000000000000000000000000000000000",
        "schema": "org.disked.fake-operation-record/1",
        "state": {
          "attempt_state": "prepared",
          "binding": {
            "attempt_id": "fake-op:474d9e117f11ea22d3a6afe9bc9900f1:attempt:1",
            "fixture_id": "fake:complete",
            "host_id": "ebb1f96469b3e4cc186d3af02b5e8a7127359574ccd4a69a6b80c505e7b2b0b7",
            "image_digest": "1f0f23d8d888fd5c897bf6479c45ba305de3f24b39b57b434a314c8771a4376b",
            "input_digest": "sha256:b0420ded17ad3b760f65f477a392a6565300b98cb45d64042da3fa8df28de166",
            "operation_id": "fake-op:474d9e117f11ea22d3a6afe9bc9900f1",
            "process_created": "134357820925471551",
            "process_id": "23392",
            "provider_id": "provider.fake.bootstrap/1",
            "source_revision": "6793d4a878a3736f5f1dcc072ac5ae0894db10aa",
            "target_profile": "windows.nt10.x64.win32",
            "worker_epoch": "worker:efd66e45b3c10ff802faa3f9b173931d"
          },
          "cancellation": "not_requested",
          "effect_certainty": "not_started",
          "last_event": "initialized",
          "logical_state": "pending",
          "outcome": null,
          "phase": "pending",
          "recovery": "unnecessary",
          "schema": "org.disked.fake-operation/1",
          "scope": "fake-only",
          "sequence": "1",
          "synthetic_effect_count": "0"
        }
      },
      "request_id": "cli",
      "schema": "org.disked.fake-operation-event/1"
    },
    "schema": "org.disked.event/1",
    "sequence": "1",
    "type": "fake.operation.record"
  },
  {
    "operation_id": "fake-op:474d9e117f11ea22d3a6afe9bc9900f1",
    "payload": {
      "observer_epoch": "watch:1b7a07ecbf94f7c22920848f3674cdf2",
      "record": {
        "digest": "40ca04a7d01bf64a68fb68d986ceb0672f3e50afe3219a35cfe91c831ced71e0",
        "previous": "9e6c3a524a4bb10824bc640c06eff0672bcabc344b9351d69f852a12d993acc2",
        "schema": "org.disked.fake-operation-record/1",
        "state": {
          "attempt_state": "prepared",
          "binding": {
            "attempt_id": "fake-op:474d9e117f11ea22d3a6afe9bc9900f1:attempt:1",
            "fixture_id": "fake:complete",
            "host_id": "ebb1f96469b3e4cc186d3af02b5e8a7127359574ccd4a69a6b80c505e7b2b0b7",
            "image_digest": "1f0f23d8d888fd5c897bf6479c45ba305de3f24b39b57b434a314c8771a4376b",
            "input_digest": "sha256:b0420ded17ad3b760f65f477a392a6565300b98cb45d64042da3fa8df28de166",
            "operation_id": "fake-op:474d9e117f11ea22d3a6afe9bc9900f1",
            "process_created": "134357820925471551",
            "process_id": "23392",
            "provider_id": "provider.fake.bootstrap/1",
            "source_revision": "6793d4a878a3736f5f1dcc072ac5ae0894db10aa",
            "target_profile": "windows.nt10.x64.win32",
            "worker_epoch": "worker:efd66e45b3c10ff802faa3f9b173931d"
          },
          "cancellation": "not_requested",
          "effect_certainty": "not_started",
          "last_event": "prepared",
          "logical_state": "active",
          "outcome": null,
          "phase": "prepared",
          "recovery": "unnecessary",
          "schema": "org.disked.fake-operation/1",
          "scope": "fake-only",
          "sequence": "2",
          "synthetic_effect_count": "0"
        }
      },
      "request_id": "cli",
      "schema": "org.disked.fake-operation-event/1"
    },
    "schema": "org.disked.event/1",
    "sequence": "2",
    "type": "fake.operation.record"
  },
  {
    "operation_id": "fake-op:474d9e117f11ea22d3a6afe9bc9900f1",
    "payload": {
      "observer_epoch": "watch:1b7a07ecbf94f7c22920848f3674cdf2",
      "record": {
        "digest": "55a29666e94b8e9e140d202807e9d1c6ce7e3889691bdf5b0b305aedde2733f5",
        "previous": "40ca04a7d01bf64a68fb68d986ceb0672f3e50afe3219a35cfe91c831ced71e0",
        "schema": "org.disked.fake-operation-record/1",
        "state": {
          "attempt_state": "dispatched",
          "binding": {
            "attempt_id": "fake-op:474d9e117f11ea22d3a6afe9bc9900f1:attempt:1",
            "fixture_id": "fake:complete",
            "host_id": "ebb1f96469b3e4cc186d3af02b5e8a7127359574ccd4a69a6b80c505e7b2b0b7",
            "image_digest": "1f0f23d8d888fd5c897bf6479c45ba305de3f24b39b57b434a314c8771a4376b",
            "input_digest": "sha256:b0420ded17ad3b760f65f477a392a6565300b98cb45d64042da3fa8df28de166",
            "operation_id": "fake-op:474d9e117f11ea22d3a6afe9bc9900f1",
            "process_created": "134357820925471551",
            "process_id": "23392",
            "provider_id": "provider.fake.bootstrap/1",
            "source_revision": "6793d4a878a3736f5f1dcc072ac5ae0894db10aa",
            "target_profile": "windows.nt10.x64.win32",
            "worker_epoch": "worker:efd66e45b3c10ff802faa3f9b173931d"
          },
          "cancellation": "not_requested",
          "effect_certainty": "in_flight",
          "last_event": "effect_dispatched",
          "logical_state": "active",
          "outcome": null,
          "phase": "in_flight",
          "recovery": "unnecessary",
          "schema": "org.disked.fake-operation/1",
          "scope": "fake-only",
          "sequence": "3",
          "synthetic_effect_count": null
        }
      },
      "request_id": "cli",
      "schema": "org.disked.fake-operation-event/1"
    },
    "schema": "org.disked.event/1",
    "sequence": "3",
    "type": "fake.operation.record"
  },
  {
    "operation_id": "fake-op:474d9e117f11ea22d3a6afe9bc9900f1",
    "payload": {
      "observer_epoch": "watch:1b7a07ecbf94f7c22920848f3674cdf2",
      "record": {
        "digest": "9f3c4dca40b2faf62cca077560a9473b9c6dfee59fb5623ca8580b9da7cc54ea",
        "previous": "55a29666e94b8e9e140d202807e9d1c6ce7e3889691bdf5b0b305aedde2733f5",
        "schema": "org.disked.fake-operation-record/1",
        "state": {
          "attempt_state": "observing",
          "binding": {
            "attempt_id": "fake-op:474d9e117f11ea22d3a6afe9bc9900f1:attempt:1",
            "fixture_id": "fake:complete",
            "host_id": "ebb1f96469b3e4cc186d3af02b5e8a7127359574ccd4a69a6b80c505e7b2b0b7",
            "image_digest": "1f0f23d8d888fd5c897bf6479c45ba305de3f24b39b57b434a314c8771a4376b",
            "input_digest": "sha256:b0420ded17ad3b760f65f477a392a6565300b98cb45d64042da3fa8df28de166",
            "operation_id": "fake-op:474d9e117f11ea22d3a6afe9bc9900f1",
            "process_created": "134357820925471551",
            "process_id": "23392",
            "provider_id": "provider.fake.bootstrap/1",
            "source_revision": "6793d4a878a3736f5f1dcc072ac5ae0894db10aa",
            "target_profile": "windows.nt10.x64.win32",
            "worker_epoch": "worker:efd66e45b3c10ff802faa3f9b173931d"
          },
          "cancellation": "not_requested",
          "effect_certainty": "observed",
          "last_event": "effect_observed",
          "logical_state": "active",
          "outcome": null,
          "phase": "observed",
          "recovery": "unnecessary",
          "schema": "org.disked.fake-operation/1",
          "scope": "fake-only",
          "sequence": "4",
          "synthetic_effect_count": "1"
        }
      },
      "request_id": "cli",
      "schema": "org.disked.fake-operation-event/1"
    },
    "schema": "org.disked.event/1",
    "sequence": "4",
    "type": "fake.operation.record"
  },
  {
    "operation_id": "fake-op:474d9e117f11ea22d3a6afe9bc9900f1",
    "payload": {
      "observer_epoch": "watch:1b7a07ecbf94f7c22920848f3674cdf2",
      "record": {
        "digest": "d22764bd40146db7b2c2df61c52ed251d53bf1bd4a8410d041c304d24ed70143",
        "previous": "9f3c4dca40b2faf62cca077560a9473b9c6dfee59fb5623ca8580b9da7cc54ea",
        "schema": "org.disked.fake-operation-record/1",
        "state": {
          "attempt_state": "finished",
          "binding": {
            "attempt_id": "fake-op:474d9e117f11ea22d3a6afe9bc9900f1:attempt:1",
            "fixture_id": "fake:complete",
            "host_id": "ebb1f96469b3e4cc186d3af02b5e8a7127359574ccd4a69a6b80c505e7b2b0b7",
            "image_digest": "1f0f23d8d888fd5c897bf6479c45ba305de3f24b39b57b434a314c8771a4376b",
            "input_digest": "sha256:b0420ded17ad3b760f65f477a392a6565300b98cb45d64042da3fa8df28de166",
            "operation_id": "fake-op:474d9e117f11ea22d3a6afe9bc9900f1",
            "process_created": "134357820925471551",
            "process_id": "23392",
            "provider_id": "provider.fake.bootstrap/1",
            "source_revision": "6793d4a878a3736f5f1dcc072ac5ae0894db10aa",
            "target_profile": "windows.nt10.x64.win32",
            "worker_epoch": "worker:efd66e45b3c10ff802faa3f9b173931d"
          },
          "cancellation": "not_requested",
          "effect_certainty": "observed",
          "last_event": "verified",
          "logical_state": "completed",
          "outcome": "succeeded",
          "phase": "finished",
          "recovery": "unnecessary",
          "schema": "org.disked.fake-operation/1",
          "scope": "fake-only",
          "sequence": "5",
          "synthetic_effect_count": "1"
        }
      },
      "request_id": "cli",
      "schema": "org.disked.fake-operation-event/1"
    },
    "schema": "org.disked.event/1",
    "sequence": "5",
    "type": "fake.operation.record"
  },
  {
    "diagnostics": [],
    "evidence": [],
    "operation_id": "fake-op:474d9e117f11ea22d3a6afe9bc9900f1",
    "request_id": "cli",
    "result": {
      "events": [],
      "last_digest": "d22764bd40146db7b2c2df61c52ed251d53bf1bd4a8410d041c304d24ed70143",